<?xml version="1.0" encoding="UTF-8"?>
<!DOCTYPE project_record SYSTEM "pr.dtd">
<?xml-stylesheet type="text/css" href="Untitled1.css"?> 
<project_record>
    <Main_Title>
        <Title>
            <bold>PROJECT RECORD</bold>
        </Title>
    </Main_Title>
    <Header>
        <list_header>
            <header_item>
                <Subtitle>
                    <bold> KEY_NAME</bold>
                </Subtitle>
                <text>PED_MICEI2002_TESES</text>
            </header_item>
            
            <header_item>
                <Subtitle>
                    <bold> KEY_NAME</bold>
                </Subtitle>
                <text>PED_MICEI2002_TESES</text>
            </header_item>
            
            <header_item>
                <Subtitle>
                    <bold> KEY_NAME</bold>
                </Subtitle>
                <text>PED_MICEI2002_TESES</text>
            </header_item>
            
            <header_item>
                <Subtitle>
                    <bold> KEY_NAME</bold>
                </Subtitle>
                <text>PED_MICEI2002_TESES</text>
            </header_item>
            
            
            <header_item>
                <Subtitle>
                    <bold> KEY_NAME</bold>
                </Subtitle>
                <text>PED_MICEI2002_TESES</text>
            </header_item>
            
            
            <header_item>
                <Subtitle>
                    <bold> KEY_NAME</bold>
                </Subtitle>
                <text>PED_MICEI2002_TESES</text>
            </header_item>
            
        </list_header>
    </Header>
    <Workteam>
        <Title>
            <bold>WorkTeam:</bold>
        </Title>
        <list_names>
            <names>
                <name>Diogo Miguel Pinto Rio</name>
                <id>a84752</id>
                <email>a84752@alunos.uminho.pt</email> 
            </names>
            
            <names>
                <name>Diogo Miguel Pinto Rio</name>
                <id>a84752</id>
                <email>a84752@alunos.uminho.pt</email> 
            </names>
            
            <names>
                <name>Diogo Miguel Pinto Rio</name>
                <id>a84752</id>
                <email>a84752@alunos.uminho.pt</email> 
            </names>
        </list_names>
    </Workteam>
    <Abstract>
        <Title>
            <bold>Abstract:</bold>
        </Title>
        <paragraph>
            <text>O XML, validado pelo schema, juntamente com o potente processamento via XSLT, permite dispor de facilidades acrescidas no tratamento de informação de uma forma standard e partilhável. Estas são, além de outras evidentes vantagens, as que abrem caminho a uma mais que provável evolução desta tecnologia nos círculos comerciais e de investigação. Outro facto importante, diz respeito à substituição de interfaces EDI por XML em aplicações bussiness oriented.</text>
        </paragraph>
        <paragraph>
            <text>O trabalho pretende definir uma estrutura expedita e funcional, passível de ser aplicada a um trabalho descritivo, como por exemplo uma tese. Não é objectivo do trabalho criar uma implementação sistemática de todos os objectos possíveis, mas sim criar algumas utilizações mais comuns para exemplificar a potência destas linguagens. </text>
        </paragraph>
    </Abstract>
    <Deliverables>
        <Title>
            <bold>Deliverables:</bold>
        </Title>
        <list_link>
            <link_item><link>wwww.somethingsomething.com</link></link_item>
            <link_item><link>wwww.somethingsomething.com</link></link_item>
            <link_item><link>wwww.somethingsomething.com</link></link_item>
        </list_link>
    </Deliverables>
</project_record>